<?xml version="1.0" encoding="UTF-8"?>
<usergroup xmlns:xsi="http://www.w3.org/2001/XMLSchema-instance" xsi:noNamespaceSchemaLocation="../xsd/usergroup.xsd">
    <name>.NET User Group Frankfurt/Main</name>
    <nickname>DNUGFFM</nickname>
    <description>Die .NET User Group Frankfurt/Main beschäftig sich als freie, unabhängige und heterogene Gruppe mit der
        .NET-Programmierung im Allgemeinen aber auch mit Produkten und Tools, die in diesem Umfeld existieren.

        Im Vordergrund steht dabei der Austausch von technologischem Wissen und Erfahrungen. Diesen Know-How Transfer
        versuchen wir in monatlichen Meetings, mit Vorträgen von Mitgliedern und namhaften Sprechern sowie mit
        Diskussionen, zu realisieren.

        Da bei uns jede .NET Programmiersprache (C#, VB.NET, IronPython, Powershell, etc.) sowie .NET Implementierung
        (z.B Rotor, Mono) willkommen ist, sind wir auch offen für alles im .NET-Universum und laden alle Interessierten
        dazu ein, Mitglied dieser Benutzergruppe zu werden.
    </description>
    <url>http://www.dotnet-usergroup.de/</url>
    <tags>
        <tag>.NET</tag>
        <tag>C#</tag>
		<tag>Microsoft</tag>
    </tags>
    <contact>
        <twitter>@dnugffm</twitter>
    </contact>
	   <defaultmeetinglocation>
        <name>Microsoft Deutschland GmbH (Geschäftsstelle Bad Homburg)</name>
        <url>https://www.microsoft.com/de-de/corporate/ueber-uns/standorte-directions.aspx</url>
        <street>Siemensstraße 27</street>
        <zip>61352</zip>
        <city>Bad Homburg</city>
    </defaultmeetinglocation>
    <schedule usedefaultmeetinglocation="true">
        <meeting>
            <time>2014-01-16T18:30:00+01:00</time>
            <name>.NET User Group Meeting - Von Null über Werbung zum Windows Store</name>
			<description>			
Wie starte ich am besten mit der Entwicklung von Windows 8 Apps? Was ist der Weg, um über Werbung in meiner App Geld zu verdienen? Wie bekomme ich meine App in den Windows Store und was passiert dann?

Diese Fragen hat sich Stefan im Sommer 2013 gestellt. In dem Vortrag schildert er seine Erfahrungen vom Erstellen der ersten App über die Nutzung von Werbung bis zum Management im Windows Store. Er geht sowohl auf technische Aspekte und Unterschiede zur "klassischen" Entwicklung von .NET Anwendungen ein als auch auf das Management von Werbung und Windows Store.

Der Vortrag richtet sich an alle, die an der Entwicklung und Veröffentlichung von Windows 8 Apps interessiert sind, selbst aber noch keine Gelegenheit dazu hatten. Natürlich sind auch erfahrene Zuhörer willkommen, die eingeladen sind, mit Ihren Diskussionsbeiträgen das Bild zu ergänzen. Am Ende des Vortrags steht eine umfangreiche Linksammlung zu den angesprochenen Punkten.

Wir freuen uns, dass wir mit Stefan mal wieder einen Sprecher aus unserer User Group mit einem Vortrag bei uns begrüßen dürfen. Sicher wird dies ein interessanter und unterhaltsamer Abend.

Im Anschluss an den Vortrag geht es dann wie gewohnt zum Networking ins Brauhaus. Dort gibt es bei einem kühlen Getränk und leckeren Speisen die Gelegenheit für vertiefende Gespräche und weiteren Austausch.
            </description>
            <url>http://www.dnug-frankfurt.de/Event/tabid/119/ID/81/Default.aspx</url>
        </meeting>
    </schedule>
</usergroup>
