<?xml version="1.0" encoding="UTF-8"?>
<usergroup xmlns:xsi="http://www.w3.org/2001/XMLSchema-instance" xsi:noNamespaceSchemaLocation="../xsd/usergroup.xsd"
           plural="true">
    <name>DevOps Frankfurt</name>
    <description>Wir tauschen Erfahrungen und Best Practices aus, die wir beim Integrieren von Continuous Integration,
        Continuous Deployment, Configuration Management, Agilen Methoden etc. im eigenen Arbeitsalltag gesammelt haben.
        Du bist hier richtig, wenn Du Spaß an Automatisierung bei der Qualitätsicherung und beim Server-Management hast.
        Entwickler und Systemadministratoren sind gleichermaßen sehr willkommen, um Erfahrungen auszutauschen und
        voneinander zu lernen. Die Talks sind auf deutsch oder english. --- Learn more about and share information on
        the DevOps movement - culture, practices and tools. This is a group for professionals (and hackers), managers,
        and engineers - from dev or ops backgrounds - that are eager to learn more about automation tools. We meet every
        second month to discuss all things DevOps. Each meeting will include a speaker on any DevOps related topic, a Q&amp;A
        session followed by drinks. We speak German and English :)
    </description>
    <url>http://www.meetup.com/DevOps-Frankfurt/</url>
    <tags>
        <tag>DevOps</tag>
    </tags>
    <schedule>
        <!-- Entweder ical-Feed angeben oder Meetings manuell eintragen -->
        <!-- ical> https://www.google.com/calendar/ical/q408a75de70rb2ebqka3i18nc0%40group.calendar.google.com/public/basic.ics
            </ical -->
        <meeting>
            <time>2013-04-17T19:00:00+02:00</time>
            <name>2. Treffen der DevOps FFM</name>
            <url>http://www.meetup.com/DevOps-Frankfurt/events/109294502/</url>
        </meeting>
    </schedule>
</usergroup>
