<?xml version="1.0" encoding="UTF-8" ?>
<usergroup xmlns:xsi="http://www.w3.org/2001/XMLSchema-instance"
           xsi:noNamespaceSchemaLocation="../xsd/usergroup.xsd" female="false">
    <name>Social Media Stammtisch Frankfurt</name>
    <nickname>SM/FFM</nickname>
    <description>Neuste Trends und Erfahrungen um das Social Web werden ausgetauscht und wirtschaftlich, kulturell oder
        auch philosophisch durchleuchtet. Alles eben, was den Social Media Profi interessiert. Ab und an werden
        Impulsvorträge gehalten. Beim Social Media Stammtisch Frankfurt geht es seit April 2010 regelmäßig um neuste
        Trends und Erfahrungen um das Social Web. Dabei werden wir das Thema möglichst breit diskutieren;
        Wirtschaftlich, kulturell oder auch philosophisch. Alles eben, was den Social Media Profi interessiert. Ab und
        an werden Impulsvorträge gehalten.
    </description>
    <url>https://www.facebook.com/socialmediafrankfurt</url>
    <tags>
        <tag>Social Media</tag>
    </tags>
    <contact>
        <googleplus>https://plus.google.com/102599953080163884985/posts</googleplus>
    </contact>
    <schedule>
        <!-- Entweder ical-Feed angeben oder Meetings manuell eintragen -->
        <!-- ical> https://www.google.com/calendar/ical/q408a75de70rb2ebqka3i18nc0%40group.calendar.google.com/public/basic.ics
            </ical -->
        <meeting>
            <time>2013-02-12T19:00:00+01:00</time>
            <name>Social Media Stammtisch #10</name>
            <url>https://www.facebook.com/events/202079356600101/</url>
            <location>
                <name>Die Zentrale</name>
                <description>Coworking in Frankfurt. Echt jetzt. Nein, wirklich. Wir sind kein Business
                    Center. Wir haben nicht nur Schreibtische und Wlan zu vermieten.
                </description>
                <url>http://www.die-zentrale-ffm.de/#section-n6</url>
                <twitter>@zentrale_ffm</twitter>
                <publictransport>U4, Tram 12, Bus 34 Bornheim Mitte</publictransport>
                <street>Berger Straße 175</street>
                <zip>60385</zip>
                <city>Frankfurt</city>
            </location>
        </meeting>
    </schedule>
    <photocredits>
        <logo>Logo: [Facebook](https://www.facebook.com/socialmediafrankfurt).</logo>
    </photocredits>
</usergroup>