<?xml version="1.0" encoding="UTF-8" ?>
<usergroup xmlns:xsi="http://www.w3.org/2001/XMLSchema-instance"
           xsi:noNamespaceSchemaLocation="../xsd/usergroup.xsd" incubator="true">
    <name>Limited WIP Society Rhein-Main</name>
    <nickname>LWSRM</nickname>
    <description>Eine Kanban Usergroup für die Rhein-Main Region</description>
    <url>https://www.xing.com/net/lwsrm</url>
    <tags>
        <tag>Kanban</tag>
    </tags>
    <contact>
        <hashtag>#lwsrm</hashtag>
    </contact>
    <team>
        <person>
            <name>Kurt Häusler</name>
            <url>https://www.xing.com/profile/Kurt_Haeusler2</url>
            <email>kurt.haeusler@gmail.com</email>
            <twitter>@Kurt_Haeusler</twitter>
        </person>
    </team>
</usergroup>
