<?xml version="1.0" encoding="UTF-8"?>
<usergroup xmlns:xsi="http://www.w3.org/2001/XMLSchema-instance" xsi:noNamespaceSchemaLocation="../xsd/usergroup.xsd">
    <name>Softwerkskammer Rhein-Main</name>
    <nickname>SWKRM</nickname>
    <description>Wir sind eine Gruppe von Softwareentwicklern, die professionell Software entwickeln möchten. 
	Dazu tauschen wir Erfahrungen zu Themen wie Clean Code, Behaviour Driven Design, Test Driven Development, Objekt-Orientiertem Design, Softwarearchitektur aber auch zu den sog. &quot;Soft Skills&quot; und den oft vernachlässigten menschlichen Aspekten der Softwareentwicklung in einem Team. 
	Wir treffen uns durchschnittlich einmal im Monat wobei das stets wechselnde Rahmenthema für ein Treffen beim vorherigen Treffen festgelegt werden.</description>
    <url>http://www.softwerkskammer.de/wiki/SoftwerkskammerFfm</url>
    <tags>
        <tag>Software Craftsmanship</tag>
        <tag>Clean Code</tag>
        <tag>Agile</tag>
    </tags>
    <contact>
        <twitter>@softwerkskammer</twitter>
        <hashtag>#swkrm</hashtag>
    </contact>
    <schedule>
        <meeting>
            <time>2013-03-25T19:00:00+01:00</time>
            <name>Treffen #16</name>
            <location>
                <name>OFfenraum coworking space</name>
                <description>Der OFfenraum ist der erste unabhängige, inhabergeführte Coworking Space in Offenbach am
                    Main.
                </description>
                <url>http://offenraum.de/#lage</url>
                <twitter>@OFfenraum</twitter>
                <publictransport>Regionalbahn HBf Offenbach. S1, S2, S8,
                    S9 Offenbach Markplatz. Bus 104 Haydnstraße.
                </publictransport>
                <street>Senefelderstr. 63</street>
                <zip>63069</zip>
                <city>Offenbach am Main</city>
            </location>
        </meeting>
        <meeting>
            <time>2013-02-25T19:00:00+01:00</time>
            <name>Treffen #15</name>
            <location>
                <name>Die Zentrale</name>
                <description>Coworking in Frankfurt. Echt jetzt. Nein, wirklich. Wir sind kein Business
                    Center. Wir haben nicht nur Schreibtische und Wlan zu vermieten.
                </description>
                <url>http://www.die-zentrale-ffm.de/#section-n6</url>
                <twitter>@zentrale_ffm</twitter>
                <publictransport>U4, Tram 12, Bus 34 Bornheim Mitte</publictransport>
                <street>Berger Straße 175</street>
                <zip>60385</zip>
                <city>Frankfurt</city>
            </location>
        </meeting>
    </schedule>
    <photocredits>
        <group>Foto: [Markus Tacker](http://tckr.cc/).</group>
    </photocredits>
</usergroup>
