<?xml version="1.0" encoding="UTF-8"?>
<usergroup xmlns:xsi="http://www.w3.org/2001/XMLSchema-instance" xsi:noNamespaceSchemaLocation="../xsd/usergroup.xsd">
    <name>Google Developer Group Rhein-Main</name>
    <nickname>GDGRM</nickname>
    <description>Everything Google.</description>
    <url>http://gdgrm.org</url>
    <tags>
        <tag>Google Technologien</tag>
    </tags>
    <contact>
        <mailinglist>
            <url>https://sites.google.com/site/gdgrheinmain/get-in-contact/anmeldung-zur-mailinglist</url>
            <label>Mailingliste</label>
        </mailinglist>
        <twitter>@gdgrheinmain</twitter>
    </contact>
    <schedule>
        <meeting>
            <time>2013-03-01T19:00:00+01:00</time>
            <name>GDG RheinMain Stammtisch Februar 2013</name>
            <url>https://plus.google.com/u/0/events/cj6qaa8m2df9gvmv1v6bp5g43t0</url>
            <location>
                <name>SRZ Gastro</name>
                <url>https://plus.google.com/105879634205744206011/about?hl=de</url>
                <street>Rotfeder-Ring 13</street>
                <zip>60327</zip>
                <city>Frankfurt</city>
            </location>
        </meeting>
    </schedule>
</usergroup>
