<?xml version="1.0" encoding="UTF-8"?>
<usergroup xmlns:xsi="http://www.w3.org/2001/XMLSchema-instance" xsi:noNamespaceSchemaLocation="../xsd/usergroup.xsd">
    <name>Rails- und Ruby-Usergroup Rhein-Main</name>
    <nickname>rugrm</nickname>
    <description>Wir treffen uns einmal pro Monat, um gemeinsam Ã¼ber aktuelle Themen in der Web-Entwicklung zu sprechen und Erfahrungen auszutauschen.</description>
    <url>http://rugrm.tumblr.com/</url>
    <tags>
        <tag>Rails</tag>
        <tag>Ruby</tag>
    </tags>
</usergroup>
